Title,Takeaway,Authors,Year,Citations,Abstract,Study Type,Journal,Journal SJR Quartile,DOI,Consensus Link
"Remission of Symptoms of Functional Neurological Disorder (FND) Utilising Novel Interventions: A Case Report","Modafinil and brain-retraining strategies effectively resolved symptoms of gelastic episodes in a patient with Functional Neurological Disorder (FND).","Roopa Rudrappa, Roni Altman, Mohanbabu Rathnaiah",2024,0,"Aims FND can be considered as an umbrella term that includes range of motor and sensory system dysfunctions with genuine symptoms including paralysis, tremors, sensory disturbance, speech disturbance and seizure. Functional seizures usually termed as Non-Epileptic attack disorder (NEAD) can result in profound persisting disability. Brief bouts of unprovoked and uncontrollable laughter, spontaneous in origin, combined with facial contraction in the form of smile, is termed as ‘gelastic seizures’. Modafinil is a dopamine modulating molecule for which evidence is accumulating towards its cognitive enhancement role in multiple domains. Furthermore, it has been shown to promote hippocampal neurogenesis and synaptic plasticity in pre-clinical studies. We report a case of FND in which pharmacological (Modafinil) and non-pharmacological interventions (Brain retraining) resulted in resolution of symptoms of probable gelastic episodes. Methods A 50-year-old lady who was referred by consultant neurologist to our Neuropsychiatry pilot service with episodes of uncontrollable laughing, singing, screaming and suffering from staggering and imbalance. Following these episodes, patient described sleeping for hours to days with fatigue. Her husband first noticed low mood 12 years ago during post-natal period. Treatment with fluoxetine reportedly contributed to ‘cyclical highs and mood variations’. One year later, her ‘gelastic episodes’ started and continued to occur every 2 or 3 months and they were brought on by a range of factors including tiredness, menstrual periods and stress. Patient also reported atypical cognitive deficits such as ‘losing vocabulary’ and ‘stuck every couple of seconds’. Furthermore, detailed history confirmed possible traits of attention deficit and hyperactive thinking since her childhood. Results Following a comprehensive assessment, the role of the brain in the manifestation of her symptoms was discussed and agreed upon. Strategies based on Cognitive Behaviour Therapy principles such as active distraction, brain retraining, engaging in therapeutic activities and expressive writing were discussed and agreed upon. Following detailed risk-benefit analysis, modafinil was initiated at 200 mg dose in the morning. Patient made a remarkable recovery nearly back to her baseline with resolution of her gelastic episodes and thus improvement in her mental state. She continues to be stable in the community. Conclusion This case highlights the importance of recognising and treating cluster of symptoms which might belong to the impulsive-compulsive spectrum. This further emphasises the role of dopamine-modulating agents such as modafinil along with brain-retraining strategies.","case report","BJPsych Open","1","10.1192/bjo.2024.686","https://consensus.app/papers/remission-of-symptoms-of-functional-neurological-rudrappa-altman/6dc25d853b1d5ce0b81c60165a848f93/"
"Natural Evolution and Heterogeneity of Neuropsychiatric Symptoms Across Neurocognitive Disorders: A Systematic Review and Meta‐Analysis of Longitudinal Studies","Neuropsychiatric symptoms show distinct and heterogeneous longitudinal patterns in neurocognitive disorders, with apathy, agitation, and apathy increasing over time, while sleep disturbances improving.","Owen Skoda, Miguel Conant, Vincent Couture, M. Bruneau, Marie-France Forget, Q. Nguyen, Philippe Desmarais",2025,0,"Neuropsychiatric symptoms (NPS) are common and burdensome manifestations of neurocognitive disorders but the characterization of their natural evolution over time is limited. We conducted a systematic review and meta-analysis to describe the longitudinal progression and heterogeneity of NPS across Alzheimer's disease (AD), Lewy body dementia (LBD), and frontotemporal dementia (FTD). We systematically reviewed observational longitudinal studies published between 2000 and 2024 assessing the prevalence or severity of NPS at ≥ 2 time points using validated instruments. Random-effects meta-analyses were performed to pool changes in prevalence (risk difference) and severity (standardized mean difference [SMD]) at short-term (< 12 months), mid-term (12 to < 24 months), and long-term (≥ 24 months) follow-up. Heterogeneity and publication bias were also assessed. Subgroup analyses were conducted by type of neurocognitive disorder. We included 26 studies comprising 5509 participants. Apathy was the most prevalent NPS at baseline (45%), followed by irritability (35%) and depression (35%). Over time, most NPS demonstrated progressive increases in prevalence, with agitation (+16%) and apathy (+15%) emerging most frequently at long-term follow-up. Severity of most NPS remained stable, except for apathy and aberrant motor behavior, which increased significantly, and sleep disturbances, which improved. Global NPS burden increased significantly at long-term (SMD +2.04). Heterogeneity of trajectories was notably high and varied across symptoms and disorders. Subgroup analyses in AD confirmed increases in apathy, delusions, and hallucinations over time. NPS exhibit distinct and heterogeneous longitudinal patterns in neurocognitive disorders. Greater understanding of these trajectories may inform clinical management, prognostication, and the timing of interventions.","meta-analysis","International Journal of Geriatric Psychiatry","1","10.1002/gps.70169","https://consensus.app/papers/natural-evolution-and-heterogeneity-of-neuropsychiatric-skoda-conant/1cb32ee6d3825f46bdc8dd130c66def4/"
"Functional Neurological Symptom Disorder in an Adopted Child with Tourette Syndrome","Conversion disorder in children is characterized by deficits in motor and sensory functions without an organic basis, and genetic variability may predispose them to react to psychological stress with functional neurological symptoms.","Vishnupriya Veeraraghavan",2022,0,"Conversion disorder is featured by the presence of deficits affecting the motor and sensory functions without any organic basis. It excludes the symptoms fully explainable by a general medical condition, substance abuse or culturally sanctioned behaviour. It mimics a neurological disorder. Dissociative/conversion disorders affect nearly 31% of children and adolescents. These children experience pivotal impairments in their academics, and daily functioning. Incidence of psychiatric comorbidities such as anxiety and depression is high in these population. Pseudoseizures followed by motor symptoms were the common presentations of conversion disorder in adolescents in India. Few of the other symptoms are weakness, aphonia, gait disturbances, abnormal movements, loss of vision and severe pain. Hysteria was observed to be the commonest neurotic disorder in children. Conversion disorder is by far the commonest form of somatoform disorder found in children. Latest research proves neural correlates for persons with genetic susceptibility for conversion symptoms. Study by Kozlowska states that larger grey matter volume in the supplementary motor area, superior temporal gyrus, and dorsomedial prefrontal cortex reflects the genetic variability that predisposes the children to react to psychological stress with functional neurological symptoms. ASEAN Journal of Psychiatry, Vol. 23(7), August 2022: 1-5.","","ASEAN Journal of Psychiatry","","10.54615/2231-7805.47280","https://consensus.app/papers/functional-neurological-symptom-disorder-in-an-adopted-veeraraghavan/c50528dab95a5882bb61fb2e56c236f9/"
"Analysis of shared heritability in common disorders of the brain","Genetic variation overlaps significantly across psychiatric disorders and behavioral traits, but neurological disorders show more distinct genetic risk profiles.","V. Anttila, Brenda Sullivan, H. Finucane, Walter Walters, J. Bras, L. Duncan, Valentina Price, G. Falcone, P. Gormley, Rainer, Malik",2018,1764,"Brainstorming diseases Consistent classification of neuropsychiatric diseases is problematic because it can lead to misunderstanding of etiology. The Brainstorm Consortium examined multiple genome-wide association studies drawn from more than 200,000 patients for 25 brain-associated disorders and 17 phenotypes. Broadly, it appears that psychiatric and neurologic disorders share relatively little common genetic risk. However, different and independent pathways can result in similar clinical manifestations (e.g., psychosis, which occurs in both schizophrenia and Alzheimer's disease). Schizophrenia correlated with many psychiatric disorders, whereas the immunopathological affliction Crohn's disease did not, and posttraumatic stress syndrome was also largely independent of underlying traits. Essentially, the earlier the onset of a disorder, the more inheritable it appeared to be. Science, this issue p. eaap8757 Heritability analysis demonstrates how genetic variation overlaps across psychiatric disorders and behavioral traits. INTRODUCTION Brain disorders may exhibit shared symptoms and substantial epidemiological comorbidity, inciting debate about their etiologic overlap. However, detailed study of phenotypes with different ages of onset, severity, and presentation poses a considerable challenge. Recently developed heritability methods allow us to accurately measure correlation of genome-wide common variant risk between two phenotypes from pools of different individuals and assess how connected they, or at least their genetic risks, are on the genomic level. We used genome-wide association data for 265,218 patients and 784,643 control participants, as well as 17 phenotypes from a total of 1,191,588 individuals, to quantify the degree of overlap for genetic risk factors of 25 common brain disorders. RATIONALE Over the past century, the classification of brain disorders has evolved to reflect the medical and scientific communities’ assessments of the presumed root causes of clinical phenomena such as behavioral change, loss of motor function, or alterations of consciousness. Directly observable phenomena (such as the presence of emboli, protein tangles, or unusual electrical activity patterns) generally define and separate neurological disorders from psychiatric disorders. Understanding the genetic underpinnings and categorical distinctions for brain disorders and related phenotypes may inform the search for their biological mechanisms. RESULTS Common variant risk for psychiatric disorders was shown to correlate significantly, especially among attention deficit hyperactivity disorder (ADHD), bipolar disorder, major depressive disorder (MDD), and schizophrenia. By contrast, neurological disorders appear more distinct from one another and from the psychiatric disorders, except for migraine, which was significantly correlated to ADHD, MDD, and Tourette syndrome. We demonstrate that, in the general population, the personality trait neuroticism is significantly correlated with almost every psychiatric disorder and migraine. We also identify significant genetic sharing between disorders and early life cognitive measures (e.g., years of education and college attainment) in the general population, demonstrating positive correlation with several psychiatric disorders (e.g., anorexia nervosa and bipolar disorder) and negative correlation with several neurological phenotypes (e.g., Alzheimer’s disease and ischemic stroke), even though the latter are considered to result from specific processes that occur later in life. Extensive simulations were also performed to inform how statistical power, diagnostic misclassification, and phenotypic heterogeneity influence genetic correlations. CONCLUSION The high degree of genetic correlation among many of the psychiatric disorders adds further evidence that their current clinical boundaries do not reflect distinct underlying pathogenic processes, at least on the genetic level. This suggests a deeply interconnected nature for psychiatric disorders, in contrast to neurological disorders, and underscores the need to refine psychiatric diagnostics. Genetically informed analyses may provide important “scaffolding” to support such restructuring of psychiatric nosology, which likely requires incorporating many levels of information. By contrast, we find limited evidence for widespread common genetic risk sharing among neurological disorders or across neurological and psychiatric disorders. We show that both psychiatric and neurological disorders have robust correlations with cognitive and personality measures. Further study is needed to evaluate whether overlapping genetic contributions to psychiatric pathology may influence treatment choices. Ultimately, such developments may pave the way toward reduced heterogeneity and improved diagnosis and treatment of psychiatric disorders. Subsection of genetic risk correlations among brain disorders and quantitative phenotypes. Heritability analysis of brain disorders points to pervasive sharing of genetic risk among psychiatric disorders. These correlations are largely absent among neurological disorders but are present for both groups in relation to neurocognitive quantitative phenotypes. Only significant correlations shown. Line color and solidity indicate direction and magnitude of correlation, respectively. Disorders of the brain can exhibit considerable epidemiological comorbidity and often share symptoms, provoking debate about their etiologic overlap. We quantified the genetic sharing of 25 brain disorders from genome-wide association studies of 265,218 patients and 784,643 control participants and assessed their relationship to 17 phenotypes from 1,191,588 individuals. Psychiatric disorders share common variant risk, whereas neurological disorders appear more distinct from one another and from the psychiatric disorders. We also identified significant sharing between disorders and a number of brain phenotypes, including cognitive measures. Further, we conducted simulations to explore how statistical power, diagnostic misclassification, and phenotypic heterogeneity affect genetic correlations. These results highlight the importance of common genetic variation as a risk factor for brain disorders and the value of heritability-based methods in understanding their etiology.","non-rct observational study","Science","1","10.1126/science.aap8757","https://consensus.app/papers/analysis-of-shared-heritability-in-common-disorders-of-the-anttila-sullivan/7deac85119e35a0cb1529dfecc73ffa8/"
"Real-time fMRI neurofeedback as a new treatment for psychiatric disorders: A meta-analysis","Real-time fMRI neurofeedback shows promising effects on depressive symptoms and anxiety, but further double-blind, multicentric, randomized-controlled trials are needed to confirm its effectiveness.","Pamela Pindi, J. Houenou, C. Piguet, P. Favre",2022,40,"","meta-analysis","Progress in Neuro-Psychopharmacology and Biological Psychiatry","1","10.1016/j.pnpbp.2022.110605","https://consensus.app/papers/realtime-fmri-neurofeedback-as-a-new-treatment-for-pindi-houenou/49e8f7609ff455dba5d867469411ca5e/"
"In- and outpatient lifestyle interventions on diet and exercise and their effect on physical and psychological health: a systematic review and meta-analysis of randomised controlled trials in patients with schizophrenia spectrum disorders and first episode of psychosis","Lifestyle interventions, particularly exercise, can improve physical and psychological health in patients with non-affective psychosis and first-episode psychosis.","B. Fernández-Abascal, P. Suárez-Pinilla, C. Cobo-Corrales, B. Crespo-Facorro, M. Suárez-Pinilla",2021,75,"","meta-analysis","Neuroscience & Biobehavioral Reviews","1","10.1016/j.neubiorev.2021.01.005","https://consensus.app/papers/in-and-outpatient-lifestyle-interventions-on-diet-and-fern%C3%A1ndez-abascal-su%C3%A1rez-pinilla/91102d80e4a751819bbf82e4270d942c/"
"Functional neurological symptom disorder (conversion disorder)","Conversion disorder is a common condition characterized by symptoms inconsistent with neurological disease, often resulting in chronic severe disability.","J. Stone, M. Sharpe",2020,4,"Conversion disorder (now also called functional neurological symptom disorder) describes symptoms (of motor and sensory dysfunction such as limb weakness, tremor, visual loss, with or without ‘blackouts’), which can be positively identified as being inconsistent with neurological disease. The disorder is common in neurological services and frequently seen by psychiatrists working in such settings. It is often associated with chronic severe disability. The diagnosis previously hinged on the neurologist’s demonstration of the lack of disease and the psychiatrist’s hypothesis of a ‘conversion’ of stress into a physical symptom. It is now based on positive findings on neurological assessment supplemented by a psychiatric assessment to confirm the diagnosis. Comorbid anxiety and depression disorders are common. Treatment is multi-disciplinary. Explanation of the condition to the patient is a crucial initial step supplemented, where necessary, by psychological treatment (especially for dissociative or non-epileptic attacks) and physiotherapy for functional motor symptoms. The prognosis without treatment is poor once the disability is established.","","New Oxford Textbook of Psychiatry","","10.1093/med/9780198713005.003.0133","https://consensus.app/papers/functional-neurological-symptom-disorder-conversion-stone-sharpe/6e88aa4484e95a9697644efca6bd1199/"
"Understanding the Role of Neuropsychiatric Symptoms in Functional Decline in Alzheimer's Disease.","Persistent apathy is strongly associated with a faster rate of functional decline in Alzheimer's disease, even after accounting for neuropsychiatric symptom classes.","Carolyn W Zhu, Lon S. Schneider, L. Soleimani, J. Neugroschl, Hillel Grossman, C. Schimming, Mary Sano",2025,2,"The authors explored classes of neuropsychiatric symptoms (NPSs) in Alzheimer's disease (AD), examined the relationship between NPS classes on rate of functional decline over time, and determined whether effects of individual symptoms on functional decline remained after controlling for NPS classes. The authors longitudinally analyzed 9,797 study participants with mild cognitive impairment or AD at baseline in the National Alzheimer's Coordinating Center Uniform Data Set. Function was measured with the Functional Assessment Questionnaire, and NPSs were assessed by using clinician judgment. Latent class analysis (LCA) was used to identify clusters of individuals who shared similar NPS profiles. Linear mixed models were used to estimate the relationship between NPS classes and individual symptom profiles in functional decline over time. LCA revealed four distinct NPS classes: an asymptomatic-mild group (48.2% of the sample, N=4,721), a second group predominantly having apathy and depression (36.4%, N=3,562), a third group with high rates of multiple symptoms except for hallucinations (12.8%, N=1,250), and a small group with high rates of all symptoms (complex class, 2.7%, N=264). NPS classes differed in baseline function but were not significantly associated with rate of functional decline. When NPS classes were controlled for, persistent apathy remained strongly associated with a faster rate of functional decline. Effects of apathy were observed across NPS classes and disease severity levels. Specific symptoms rather than classes of symptoms were associated with the trajectory of functional decline in AD. Apathy may be particularly useful for tracking longitudinal changes in function.","non-rct observational study","The Journal of neuropsychiatry and clinical neurosciences","2","10.1176/appi.neuropsych.20250015","https://consensus.app/papers/understanding-the-role-of-neuropsychiatric-symptoms-in-zhu-schneider/da1cf41b134857e69f949b69ca1ad449/"
"Recent advances in understanding the neurobiology of pediatric functional neurological disorder","Pediatric functional neurological disorder is influenced by aberrant brain network changes and stress-system activation, with factors like adverse childhood experiences and stress-system dysregulation contributing to these changes.","K. Kozlowska, Stephen Scher",2024,14,"Functional neurological disorder (FND) is a neuropsychiatric disorder that manifests in a broad array of functional motor, sensory, or cognitive symptoms, which arise from complex interactions between brain, mind, body, and context. Children with FND make up 10%-20% of presentations to neurology services in children's hospitals and up to 20% of adolescents admitted to hospital for the management of intractable seizures. The current review focuses on the neurobiology of pediatric FND. The authors present an overview of the small but growing body of research pertaining to the biological, emotion-processing, cognitive, mental health, physical health, and social system levels. Emerging research suggests that pediatric FND is underpinned by aberrant changes within and between neuron-glial (brain) networks, with a variety of factors - on multiple system levels - contributing to brain network changes. In pediatric practice, adverse childhood experiences (ACEs) are commonly reported, and activation or dysregulation of stress-system components is a frequent finding. Our growing understanding of the neurobiology of pediatric FND has yielded important flow-on effects for assessing and diagnosing FND, for developing targeted treatment interventions, and for improving the treatment outcomes of children and adolescents with FND.","literature review","Expert Review of Neurotherapeutics","1","10.1080/14737175.2024.2333390","https://consensus.app/papers/recent-advances-in-understanding-the-neurobiology-of-kozlowska-scher/324311059dd9596199e21b8c281f7fdc/"
"Functional Neurological Symptom Disorder (Conversion Disorder) from an Interactional Approach: A Composite Case Study","Functional neurological symptom disorder (FNSD-CD) may be a result of a problem in an individual's relationship, rather than an individual's internal disorder.","L. M. Dennis, W. D. Phipps",2020,1,"<jats:p>Functional neurological symptom disorder, alternatively termed conversion disorder (FNSD‐CD) (Although the <jats:italic>DSM‐5</jats:italic> utilises the term 'conversion disorder', practitioners and consumers consider this to be an outdated, unsubstantiated and often stigmatising term. In accordance with this, the current terminology used in the field is 'functional neurological symptom disorder'), involves symptoms of altered voluntary motor or sensory functions without identifiable nervous system disease or pathology. It is considered a psychiatric disorder and is, thus, listed in the <jats:italic>Diagnostic and Statistical Manual of Mental Disorders</jats:italic> (5th Ed.; <jats:italic>DSM‐5</jats:italic>). As per the nosology of the <jats:italic>DSM‐5</jats:italic>, the discrete behavioural or psychological syndrome or pattern observed in FNSD‐CD is assumed to be a function of a problem of, or a disorder within, the individual. Accordingly, the psychiatric approach to FNSD‐CD, as set out in the <jats:italic>DSM‐5</jats:italic>, invokes an assumption common to the medical model which is that of lineal (i.e., straight‐line) causality, namely, causal events are arranged in a lineal sequence. The interactional approach, however, which is a development of general system theory in the field of family therapy, offers an alternative approach to understanding psychiatric disorders. Specifically, this approach places the emphasis on the relationships between individuals and their reciprocal influences on – including their psychological and emotional wellbeing with – one another. It draws on the assumption of nonlineal (i.e., circular) causality, namely, causal events are arranged in a circular sequence. From an interactional approach, therefore, FNSD‐CD is thought to be a function of a problem of, or a deficit within, the individuals’ relationship/s, rather than within an individual, per se. This article utilises a composite case study to investigate FNSD‐CD from an interactional approach.</jats:p>","","Australian and New Zealand Journal of Family Therapy","2","10.1002/anzf.1434","https://consensus.app/papers/functional-neurological-symptom-disorder-conversion-dennis-phipps/a06244b377d850cf991df9c1fa96cb85/"
