Title,Takeaway,Authors,Year,Citations,Abstract,Study Type,Journal,Journal SJR Quartile,DOI,Consensus Link
"Diagnosis and management of functional neurological disorder","Functional neurological disorder (FND) is now a rule-in diagnosis with available treatments, including physical and occupational therapy for motor symptoms and psychotherapy for seizure type symptoms.","S. Aybek, D. Perez",2022,201,"Functional neurological disorder (FND), previously regarded as a diagnosis of exclusion, is now a rule-in diagnosis with available treatments. This represents a major step toward destigmatizing the disorder, which was often doubted and deemed untreatable. FND is prevalent, generally affecting young and middle aged adults, and can cause severe disability in some individuals. An early diagnosis, with subsequent access to evidence based rehabilitative and/or psychological treatments, can promote recovery-albeit not all patients respond to currently available treatments. This review presents the latest advances in the use of validated rule-in examination signs to guide diagnosis, and the range of therapeutic approaches available to care for patients with FND. The article focuses on the two most frequently identified subtypes of FND: motor (weakness and/or movement disorders) and seizure type symptoms. Twenty two studies on motor and 27 studies on seizure type symptoms report high specificities of clinical signs (64-100%), and individual signs are reviewed. Rehabilitative interventions (physical and occupational therapy) are treatments of choice for functional motor symptoms, while psychotherapy is an emerging evidence based treatment across FND subtypes. The literature to date highlights heterogeneity in responses to treatment, underscoring that more research is needed to individualize treatments and develop novel interventions.","literature review","BMJ","1","10.1136/bmj.o64","https://consensus.app/papers/diagnosis-and-management-of-functional-neurological-aybek-perez/980de8412cc359519e3acced45bef4cc/"
"[Understanding functional neurological disorders: From biological markers to pathophysiological models].","Functional neurological symptoms are influenced by multiple brain networks and stress response mechanisms, with a biopsychosocial model helping to understand predisposing, precipitating, and perpetuating factors.","Ismael Conejero, E. Thouvenot, C. Hingray, C. Hubsch, W. El-Hage, G. Carle-Toulemonde, J. Rotge, S. Drapier, D. Drapier, S. Mouchabac",2023,5,"","literature review","L'Encephale","1","10.1016/j.encep.2023.06.003","https://consensus.app/papers/understanding-functional-neurological-disorders-from-conejero-thouvenot/ca019f12d88056588063018ef709c293/"
"Emotional processing in functional neurological disorder: a review, biopsychosocial model and research agenda","Altered emotional processing, linked to psychosocial risk factors, may play a key role in functional neurological disorder.","S. Pick, L. Goldstein, D. Perez, T. Nicholson",2018,231,"Functional neurological disorder (FND) is a common and highly disabling disorder, but its aetiology remains enigmatic. Conceptually, there has been reduced emphasis on the role of psychosocial stressors in recent years, with a corresponding increase in neurobiological explanations. However, a wealth of evidence supports the role of psychosocial adversities (eg, stressful life events, interpersonal difficulties) as important risk factors for FND. Therefore, there is a need to integrate psychosocial (environmental) and neurobiological factors (eg, sensorimotor and cognitive functions) in contemporary models of FND. Altered emotional processing may represent a key link between psychosocial risk factors and core features of FND. Here, we summarise and critically appraise experimental studies of emotional processing in FND using behavioural, psychophysiological and/or neuroimaging measures in conjunction with affective processing tasks. We propose that enhanced preconscious (implicit) processing of emotionally salient stimuli, associated with elevated limbic reactivity (eg, amygdala), may contribute to the initiation of basic affective/defensive responses via hypothalamic and brainstem pathways (eg, periaqueductal grey). In parallel, affect-related brain areas may simultaneously exert a disruptive influence on neurocircuits involved in voluntary motor control, awareness and emotional regulation (eg, sensorimotor, salience, central executive networks). Limbic-paralimbic disturbances in patients with FND may represent one of several neurobiological adaptations linked to early, severe and/or prolonged psychosocial adversity. This perspective integrates neurobiological and psychosocial factors in FND and proposes a research agenda, highlighting the need for replication of existing findings, multimodal sampling across emotional response domains and further examination of emotional influences on sensorimotor and cognitive functions in FND populations.","literature review","Journal of Neurology, Neurosurgery, and Psychiatry","1","10.1136/jnnp-2018-319201","https://consensus.app/papers/emotional-processing-in-functional-neurological-pick-goldstein/3cf67089a5d951f08f2d73a9bf8cc5fe/"
"Comorbidities Across Functional Neurological Disorder Subtypes: A Comprehensive Narrative Synthesis","Comorbid psychiatric and somatic conditions are prevalent across all functional neurological disorder subtypes, highlighting the need for individualized diagnostic and therapeutic approaches.","Ioannis A. Mavroudis, Katerina Franekova, Foivos E Petridis, A. Ciobîcă, Dăscălescu Gabriel, Emil Anton, C. Ilea, S. Papagiannopoulos, D. Kazis",2025,3,"Functional Neurological Disorder (FND) encompasses a spectrum of symptoms-including motor, cognitive, and seizure-like manifestations-that are not fully explained by structural neurological disease. Accumulating evidence suggests that comorbid psychiatric and somatic conditions significantly influence the clinical course, diagnostic complexity, and treatment response in FND. This study systematically explores psychiatric and medical comorbidities across major FND subtypes-Functional Cognitive Disorder (FCD), Functional Movement Disorder (FMD), and Psychogenic Non-Epileptic Seizures (PNES)-with an emphasis on subtype-specific patterns and shared vulnerabilities. We conducted a narrative review of the published literature, guided by systematic principles for transparency, covering both foundational and contemporary sources to examine comorbid conditions in patients with FCD, FMD, PNES, PPPD and general (mixed) FND populations. Relevant studies were identified through structured research and included based on methodological rigor and detailed reporting of comorbidities (PRISMA). Extracted data were organized by subtype and comorbidity type (psychiatric or medical/somatic). Across all FND subtypes, high rates of psychiatric comorbidities were observed, particularly depression, anxiety, PTSD, and dissociative symptoms. FCD was predominantly associated with internalizing symptoms, affective misattribution, and heightened cognitive self-monitoring. FMD demonstrated strong links with trauma, emotional dysregulation, and personality vulnerabilities. PNES was characterized by the highest burden of psychiatric illness, with complex trauma histories and dissociation frequently reported. Somatic comorbidities-such as fibromyalgia, chronic pain, irritable bowel syndrome, and fatigue-were also prevalent across all subtypes, reflecting overlapping mechanisms involving interoception, central sensitization, and functional symptom migration. Comorbid psychiatric and medical conditions are integral to understanding the presentation and management of FND. Subtype-specific patterns underscore the need for individualized diagnostic and therapeutic approaches, while the shared biopsychosocial mechanisms suggest benefits of integrated care models across the FND spectrum.","systematic review","Life","2","10.3390/life15081322","https://consensus.app/papers/comorbidities-across-functional-neurological-disorder-mavroudis-franekova/3053f8d427f45b238efb2339d527b59b/"
"Treatment of functional neurological disorder: an umbrella review of systematic reviews and meta-analyses","CBT and physiotherapy show consistent benefits for functional neurological disorder, but more tailored, multimodal approaches are needed for optimal management.","Ioannis A. Mavroudis, F. Petrides, Katerina Franekova, Cătălina Ionescu, A. Ciobîcă, D. Kazis",2025,0,"Functional Neurological Disorder (FND) is among the most common reasons for neurology outpatient referrals, characterized by disabling motor, sensory, speech, and dissociative symptoms. It poses diagnostic and therapeutic challenges, often requiring multidisciplinary management and a biopsychosocial framework. To perform an umbrella review of systematic reviews and meta-analyses evaluating treatment efficacy across different FND subtypes, stratifying by intervention type, outcome direction, and quality of evidence. We systematically screened and analyzed 17 reviews encompassing psychological therapies, physiotherapy, neuromodulation, multidisciplinary rehabilitation, and pharmacological approaches. Studies were assessed for effect direction, GRADE certainty, and risk of bias across 10 methodological domains. Cognitive behavioral therapy (CBT) demonstrated consistent benefit for PNES and mixed presentations, particularly when delivered within multidisciplinary frameworks. Physiotherapy showed moderate improvements in functional motor symptoms, while neuromodulation yielded promising but inconsistent results. Hypnosis and suggestion-based treatments provided subjective benefit in select cases, whereas pharmacological interventions were largely used adjunctively to manage psychiatric comorbidities. Risk of bias and heterogeneity in outcome measures limited direct comparisons, and the overall methodological quality varied across studies. FND management appears to benefit most from tailored, multimodal approaches. While CBT and physiotherapy remain foundational, the overall quality of evidence remains moderate at best, highlighting a need for standardized outcome measures and rigorous trial designs to strengthen future practice guidelines.","systematic review","Journal of Neurology","1","10.1007/s00415-025-13449-7","https://consensus.app/papers/treatment-of-functional-neurological-disorder-an-mavroudis-petrides/19ab1a725f785abebe849ebca9355603/"
"Neuropsychiatric symptoms cluster and fluctuate over time in behavioral variant frontotemporal dementia","Neuropsychiatric symptoms in behavioral variant frontotemporal dementia cluster into four groups, with fluctuating nature suggesting they may not be reliable markers of disease progression or stage.","C. Morrow, V. Kamath, Bradford C. Dickerson, M. Eldaief, Neguine Rezaii, Bonnie Wong, Scott M. McGinnis, R. Darby, A. Staffaroni, M. Lapid, B. Pascual, Julio C. Rojas, Joseph C. Masdeu, K. Tsapkini, Edward D. Huey, Daniel W Fisher, A. Pantelyat, A. Balaji, Eric Sah, I. Litvan, K. Rascovsky, N. Ghoshal, K. Domoto-Reilly, J. Kornak, C. Onyike",2025,7,"Cognitive and behavioral phenomena define behavioral variant frontotemporal dementia (bvFTD), but neuropsychiatric symptoms (NPS) outside the core criteria are common throughout the illness. Identifying how NPS cluster in bvFTD may guide development of future therapies. Participants (n = 354) with sporadic and genetic bvFTD were enrolled in the ARTFL LEFFTDS Longitudinal Frontotemporal Lobar Degeneration Consortium. Dementia stage was defined as early (CDR® plus NACC FTLD ≤1) or advanced (CDR® plus NACC FTLD ≥1). Baseline and annual follow-up visit data were analyzed to compare NPS across stages of bvFTD. Psychiatric states were captured using the Neuropsychiatric Inventory-Questionnaire and Clinician Judgment of Symptoms. Polychoric cluster analysis was used to describe NPS clusters. NPS were highly prevalent (≥90%) in early and late bvFTD. Four NPS clusters were identified based on magnitude of factor loadings: affective, disinhibited, compulsive, and psychosis. Neuropsychiatric symptoms fluctuated across visits. In the affective cluster, depression showed the least visit-to-visit stability. In the disinhibited cluster, elation showed the least stability. Symptoms in the psychosis and compulsive clusters (hallucinations, delusions, obsessions/compulsions, and hyperorality) were largely stable, persisting from visit-to-visit in more than 50% of cases. Symptoms in the affective and disinhibited cluster were associated with the highest caregiver burden, while symptoms in the obsessive cluster were associated with the most functional impairment. NPS in bvFTD are frequent and cluster into four discrete groups. The fluctuating nature of some NPS in bvFTD suggests that they may not be reliable markers of disease progression or stage.","non-rct observational study","Psychiatry and Clinical Neurosciences","1","10.1111/pcn.13810","https://consensus.app/papers/neuropsychiatric-symptoms-cluster-and-fluctuate-over-morrow-kamath/1d9d866a00f353c1982dca36322a9384/"
"Mental Health Consequences of Traumatic Brain Injury","Traumatic brain injury (TBI) can cause a host of psychiatric and neurobehavioral problems, with milder injuries leading to affective symptoms, suicidality, and worsening of psychiatric disorders.","Jonathon R. Howlett, L. Nelson, Murray B. Stein",2021,239,"","","Biological Psychiatry","1","10.1016/j.biopsych.2021.09.024","https://consensus.app/papers/mental-health-consequences-of-traumatic-brain-injury-howlett-nelson/cb3a8f06aeed5955a6d643b68b74bca7/"
"Emotion Induced Monoamine Neuromodulator Release Affects Functional Neurological Disorders","Emotional stress and psychosocial adversity contribute to the pathogenesis of functional neurologic disorders, offering potential therapeutic drug targets or psychological intervention methods in the future.","Fei Liang, Qiuyue Xu, Mingchen Jiang, Rou Feng, Shan Jiang, Bin Yuan, Shijun Xu, Ting Wu, Fushun Wang, Jason H. Huang",2021,19,"Functional neurologic disorders (FNDs), also called conversion disorder (previously called hysteria), can show almost all the symptoms of other neurological diseases, including both physical (for example, seizure, weakness, fatigue) and psychological (for instance, depression, anxiety) symptoms. In spite of our general knowledge about emotional processes and developmental defects in the formation of these somatic symptoms, there is still no systemic and comprehensive research on the effects of emotional developmental variables in FND. Recently, both experimental and theoretical emotion studies have been greatly increased, such as prediction error, conceptual act model, basic emotional theory, and monoamine neuromodulator based three primary emotions. In addition, a large amount of evidence has confirmed the role of psychosocial adversity (such as stressful life events, interpersonal difficulties) as an important risk factor for FND. Here, we review recent advances about emotional stress on FND, and pay special attention to the effects of monoamine neuromodulators, such as how norepinephrine and serotonin affect behaviors. Then, we discuss the significance of these changes for FND, which may contribute to clarifying the pathogenesis of FND, and thus provide potential therapeutic drug targets or psychological intervention methods in the future.","","Frontiers in Cell and Developmental Biology","1","10.3389/fcell.2021.633048","https://consensus.app/papers/emotion-induced-monoamine-neuromodulator-release-liang-xu/27deaf0fbe3051ef8732e3991d4e2fbd/"
"Nutrition and mental health: A review of current knowledge about the impact of diet on mental health","A rational diet, physical activity, psychobiotics, and antioxidant consumption have the highest therapeutic potential for improving mental health.","Mateusz Grajek, K. Krupa-Kotara, Agnieszka Białek-Dratwa, K. Sobczyk, M. Grot, Oskar Kowalski, Wiktoria Staśkiewicz",2022,140,"Applied psychopharmacotherapy and psychotherapy do not always bring the expected results in the treatment of mental disorders. As a result, other interventions are receiving increasing attention. In recent years, there has been a surge in research on the effects of nutrition on mental status, which may be an important aspect of the prevention of many mental disorders and, at the same time, may lead to a reduction in the proportion of people with mental disorders. This review aims to answer whether and to what extent lifestyle and related nutrition affect mental health and whether there is scientific evidence supporting a link between diet and mental health. A review of the scientific evidence was conducted based on the available literature by typing in phrases related to nutrition and mental health using the methodological tool of the PubMed database. The literature search yielded 3,473 records, from which 356 sources directly related to the topic of the study were selected, and then those with the highest scientific value were selected according to bibliometric impact factors. In the context of current changes, urbanization, globalization, including the food industry, and changes in people's lifestyles and eating habits, the correlations between these phenomena and their impact on mental state become important. Knowledge of these correlations creates potential opportunities to implement new effective dietary, pharmacological, therapeutic, and above all preventive interventions. The highest therapeutic potential is seen in the rational diet, physical activity, use of psychobiotics, and consumption of antioxidants. Research also shows that there are nutritional interventions that have psychoprotective potential.","systematic review","Frontiers in Nutrition","1","10.3389/fnut.2022.943998","https://consensus.app/papers/nutrition-and-mental-health-a-review-of-current-knowledge-grajek-krupa-kotara/1dc29235a38251d4be04511532b89cff/"
"Functional Neurological Disorder: a multidisciplinary approach","A multidisciplinary approach is crucial for accurately diagnosing functional neurological disorders, as absence of clear psychological triggers and presence of neurological alterations can hinder study.","C. Alvarez Garcia, A. Gomez Martín, M.D.C. Molina Liétor, I. Cuevas Iñiguez, A. Sanz- Giancola",2022,1,"Introduction Functional neurological disorders (FNDs), also known as “conversion disorder”, consist in the appearance of neurological symptoms that do not correspond to any medical condition and produces an impairment in social, occupational and other areas in the patient’s life. This disorder can represent up to 30% of neurologist’s consultation. We introduce the case of a 23-year-old man who attended the emergency services due to fainting and was finally diagnosed with FND. Objectives To summarize the difficulties of making a diagnosis of FND and the importance of a multidisciplinary approach. Methods A narrative review through the presentation of a case. Results The patient presented many absence seizures during his stay in the hospital. These episodes were characterized by non-reactivity, dysarthria, tremors, tachycardia and hyperventilation. The neurological examination and imaging tests didn’t show any pathological findings. During the psychiatric interview he revealed he had lived a severe conflict with his brothers the previous week and he was being excluded within his family. Furthermore he didn’t have any social support besides his mother in the city he was living, leading this situation to an incrementation of anxiety. Due to the absence of any abnormalities in the examination and recent psychological conflict that was affecting him, FND diagnose was made. Conclusions Very frequently the absence of a clear psychological trigger and the presence of neurological alterations can hinder the study of the patient. This makes necessary a multidisciplinary approach and the knowledge of signs that can help to carry out an accurate diagnosis. Disclosure No significant relationships.","case report","European Psychiatry","1","10.1192/j.eurpsy.2022.1002","https://consensus.app/papers/functional-neurological-disorder-a-multidisciplinary-garcia-mart%C3%ADn/2732595bca89517a8fed7b2c9c5b78a2/"
"Agraphia due to Conversion Disorder (Functional Neurological Symptom Disorder) in an 8-year-old boy: a case report","Pediatric conversion disorder can be effectively treated with tailored psychological interventions and addressing familial dynamics, leading to rapid symptom improvement and successful school reintegration.","Nhu Minh Hang Tran, Tran Tuan Anh Le, Vu Quoc Huy Nguyen",2025,0,"Conversion disorder, a psychiatric condition characterized by neurological symptoms without organic etiology, is rare in children but can significantly impair functioning. This case report describes an 8-year-old boy presenting with sudden onset of hand tremors, inability to write, and recurrent abdominal pain following a three-month summer vacation and increased academic demands. Despite extensive neurological evaluations (MRI, EEG, EMG) showing no organic abnormalities, symptoms persisted, exacerbated by social isolation and secondary gains from family and school accommodations. Treatment with play therapy, cognitive therapy emphasizing fairness, and parental guidance to reduce overindulgence led to rapid symptom improvement within days. Follow-up over twenty months demonstrated sustained recovery and successful school reintegration. This case highlights the interplay of academic stress, psychological defense mechanisms, and secondary gains in pediatric conversion disorder, underscoring the efficacy of tailored psychological interventions and the importance of addressing familial dynamics to mitigate symptom persistence.","case report","Frontiers in Psychiatry","1","10.3389/fpsyt.2025.1687215","https://consensus.app/papers/agraphia-due-to-conversion-disorder-functional-tran-le/fcb4538dd960563494d6e9e2ec799854/"
"Influence of Lifestyle on Brain Sensitivity to Circulating Insulin-like Growth Factor 1","Social isolation and a high-fat diet increase anxiety and depression-like behavior in mice, with loss of brain IGF-1 input contributing to mood disturbances.","J. Zegarra-Valdivia, M. Z. Khan, Aurora Putzolu, Raffaela Cipriani, J. Pignatelli, I. Torres Alemán",2025,0,"Lifestyle factors, including social relationships and diet, influence mood homeostasis, a mechanism often dysregulated in high-incidence mental illnesses like depression and Alzheimer's dementia (AD). Given that insulin-like growth factor 1 (IGF-1) modulates mood and its blood levels are altered in both AD and affective disorders, we investigated whether IGF-1 activity in the brain was affected in mice subjected to social isolation or a high-fat diet (HFD). We found that both lifestyle conditions increased anxiety and depression-like behavior in C57BL/6 mice of both sexes, as determined by the elevated zero maze/open field tests and the forced swim test, respectively. These lifestyle conditions were associated with loss of neuronal responses to systemic IGF-1. Enhanced neuronal activity in the prefrontal cortex-measured via Cafiber photometry following intraperitoneal IGF-1 administration-was absent in both socially isolated and HFD-fed mice. However, only the HFD-fed group exhibited elevated serum IGF-1 levels. These findings suggest that loss of brain IGF-1 input may contribute to the observed mood disturbances, providing potential new targets to explore the heightened risk of depression and AD associated with loneliness and unhealthy diets in humans. Importantly, because reduced IGF-1 activity in the brain is not consistently reflected in serum levels, serum measurements are an unreliable indicator of brain IGF-1 activity.","non-rct experimental","International Journal of Molecular Sciences","1","10.3390/ijms262010008","https://consensus.app/papers/influence-of-lifestyle-on-brain-sensitivity-to-zegarra-valdivia-khan/d72c082612fe5670ae8ebc9b523a202e/"
