Title,Takeaway,Authors,Year,Citations,Abstract,Study Type,Journal,Journal SJR Quartile,DOI,Consensus Link
"Wired for Intensity: The Neuropsychological Dynamics of Borderline Personality Disorders—An Integrative Review","Early neurodevelopmental vulnerability and maladaptive neurophysiological processes contribute to borderline personality disorder, with emotional dysregulation being a central mechanism and self-harm potentially serving as a strategy for regulating emotions.","Eleni Giannoulis, Christos Nousis, Maria Krokou, Ifigeneia Zikou, Ioannis A Malogiannis",2025,0,"Borderline personality disorder (BPD) is a severe psychiatric condition characterised by emotional instability, impulsivity, interpersonal dysfunction, and self-injurious behaviours. Despite growing clinical interest, the neuropsychological mechanisms underlying these symptoms are still not fully understood. This review aims to summarise findings from neuroimaging, psychophysiological, and neurodevelopmental studies in order to clarify the neurobiological and physiological basis of BPD, with a particular focus on emotional dysregulation and implications for the treatment of adolescents.A narrative review was conducted, integrating results from longitudinal neurodevelopmental studies, functional and structural neuroimaging research (e.g. FMRI and PET), and psychophysiological assessments (e.g., heart rate variability and cortisol reactivity). Studies were selected based on their contribution to understanding the neural correlates of BPD symptom dimensions, particularly emotion dysregulation, impulsivity, interpersonal dysfunction, and self-harm.Findings suggest that early reductions in amygdala volume, as early as age 13 predict later BPD symptoms. Hyperactivity of the amygdala, combined with hypoactivity in the prefrontal cortex, underlies deficits in emotion regulation. Orbitofrontal abnormalities correlate with impulsivity, while disruptions in the default mode network and oxytocin signaling are related to interpersonal dysfunction. Self-injurious behaviour appears to serve a neuropsychological function in regulating emotional pain and trauma-related arousal. This is linked to disruption of the hypothalamic-pituitary-adrenal (HPA) axis and structural brain alterations. The Unified Protocol for Adolescents (UP-A) was more effective to Mentalization-Based Therapy for Adolescents (MBT-A) at reducing emotional dysregulation compared, though challenges in treating identity disturbance and relational difficulties remain.The reviewed evidence suggests that BPD has its in early neurodevelopmental vulnerability and is sustained by maladaptive neurophysiological processes. Emotional dysregulation emerges as a central transdiagnostic mechanism. Self-harm may serve as a strategy for regulating emotions in response to trauma-related neural dysregulation. These findings advocate for the integration of neuroscience into psychotherapeutic practice, including the application of neuromodulation techniques and psychophysiological monitoring.A comprehensive understanding of BPD requires a neuropsychologically informed framework. Personalised treatment approaches combining pharmacotherapy, brain-based interventions, and developmentally adapted psychotherapies-particularly DBT, psychodynamic therapy, and trauma-informed care-are essential. Future research should prioritise interdisciplinary, longitudinal studies to further bridge the gap between neurobiological findings and clinical innovation.","literature review","Journal of Clinical Medicine","1","10.3390/jcm14144973","https://consensus.app/papers/wired-for-intensity-the-neuropsychological-dynamics-of-giannoulis-nousis/7050bf38e7d3557686a19d54d2b373ed/"
"Impact of Daily Life Factors on Physical and Mental Health","A healthy lifestyle, including consistent physical exercise, a well-rounded diet, sufficient rest, and stress control, can significantly improve mental well-being and reduce the risk of mental health issues.","Pratyush Pandey, Anurag Mishra",2024,2,"Research regularly shows the significant influence of lifestyle selections on mental well-being. Embracing a healthy lifestyle can result in significant advantages such as less stress, improved mood, and general well-being improvements. An integrated strategy involving consistent physical exercise, a well-rounded diet, sufficient rest, and successful stress control is very impactful. Participating in physical activity stimulates the secretion of endorphins and other neurotransmitters that reduce stress and improve mood. A balanced diet with key nutrients like carbohydrates, proteins, fats, dietary fiber, water, phytonutrients, and antioxidants can help prevent and manage mental health conditions. Morbid lifestyle choices including smoking, excess liquor consumption, and a poor diet can greatly increase the risk of mental health issues. Smoking not only endangers physical health but also increases the likelihood of sadness and anxiety by negatively affecting neurotransmitter regulation. Overconsumption of alcohol can disturb the intricate equilibrium of brain chemistry, which may result in illnesses such as alcohol-induced sadness and anxiety. A diet rich in processed foods, and heavy in sugar and saturated fats, lacks the vital elements needed for healthy brain function and emotional well-being, making individuals more susceptible to mood disorders. This research paper explores the complex connection between lifestyle choices and mental health, highlighting the crucial impact of these choices on psychological well-being. This study reveals through extensive empirical evidence the significant capacity of lifestyle changes to alleviate the impact of mental health problems on society. It emphasizes the crucial need for public health programs and personal behavior modifications to prioritize and encourage healthy lifestyle decisions as a fundamental aspect of mental health and overall quality of life for everyone.","","2024 2nd International Conference on Disruptive Technologies (ICDT)","","10.1109/icdt61202.2024.10489692","https://consensus.app/papers/impact-of-daily-life-factors-on-physical-and-mental-health-pandey-mishra/191d781002f357c0be4a830f633dffde/"
"The intricate brain-body interaction in psychiatric and neurological diseases.","Brain-body interaction dysfunctions are common in psychiatric, neurological, and neurodegenerative diseases, and understanding these interactions can lead to new therapeutic approaches.","Francesco Di Gregorio, Simone Battaglia",2024,35,"A harmonic brain-body communication is fundamental to individual wellbeing and is the basis of human cognition and behavior. In the last 2 decades, the interaction between the brain and body functioning has become a central area of study for neurologists and neuroscientists in clinical and non-clinical contexts. Indeed, brain-body axis dysfunctions occur in many psychiatric, neurological and neurodegenerative diseases. This editorial will focus on recent advances and future therapeutic perspectives for studying brain-body interactions in health and diseases.","","Advances in clinical and experimental medicine : official organ Wroclaw Medical University","1","10.17219/acem/185689","https://consensus.app/papers/the-intricate-brainbody-interaction-in-psychiatric-and-gregorio-battaglia/10c532eb1acd5f82ba6a13a941ceffe4/"
"Lifestyle-based interventions targeting neurocognition in bipolar disorders – a systematic review of randomized controlled trials","Nutraceuticals like citicoline and creatine show potential pro-cognitive effects for individuals with bipolar disorder, but more research is needed.","V. Balanzá-Martínez, Alejandro Galdámez-Huertas, J. V. Sánchez-Ortí, Flávio Kapczinski, Raquel B. De Boni, Edith Pomarol-Clotet, T. E. Rheenen",2025,0,"","systematic review","Psychiatry Research","1","10.1016/j.psychres.2025.116618","https://consensus.app/papers/lifestylebased-interventions-targeting-neurocognition-balanz%C3%A1-mart%C3%ADnez-gald%C3%A1mez-huertas/f82ea0b2a6bf54688506ba0f3a349cc7/"
"When Mind and Body Speaks: Understanding Dissociative Neurological Symptom Disorder-ICD–11","A multidisciplinary approach, addressing psychological stressors, and utilizing psychosocial interventions significantly improved the patient's condition and symptom resolution within 18 months.","S. Bokhari, Aysha Butt, Q. M. Bokhari, Rehma Shanze Alam, Aimen Saleem",2025,0,"Aims: Dissociative Neurological Symptom Disorder (DNSD), also known as Conversion Disorder, is a common diagnosis among mental health patients in Pakistan. Despite its prevalence, research on DNSD, especially regarding patient experiences, is limited. Family-related stressors are significant contributing factors in its development, with familial discord playing a key role in triggering symptoms. Methods: A 24-year-old female was referred by a neurologist after presenting to the outpatient department in a wheelchair due to a fear of falling. She reported symptoms including jerky body movements, episodes of apparent loss of consciousness, diarrhoea, weakness, visual disturbances, headaches, and palpitations, which had persisted for over two years. Despite multiple consultations, no organic cause was identified. She had been prescribed various medications with no improvement. Upon evaluation, a diagnosis of DNSD was made, compounded by significant emotional stress, particularly familial discord. A multidisciplinary approach, involving specialists in neurology, ophthalmology, ENT, and gastroenterology, helped rule out underlying physical conditions. Her pre-morbid history indicated high academic achievement but chronic familial stress. Results: This case emphasizes the importance of recognizing psychosomatic presentations in patients with unexplained neurological and physical symptoms. Despite extensive negative investigations, the patient’s psychological stressors, such as familial discord and fear of stigma, were key contributors to the onset of her symptoms. The patient’s fear of walking further exacerbated her physical disability. Treatment included sertraline, mirtazapine, and short-term benzodiazepines for anxiety and depression. Psychological therapies such as Cognitive Behavioural Therapy (CBT), deep breathing, safe-place visualization, imaginal exposure, systematic desensitization, and gratitude journalling were used to address emotional issues and reduce disability. This comprehensive approach resulted in symptom resolution, and the patient was symptom-free within 18 months, now pursuing an MPhil degree. Conclusion: This case highlights the value of a multidisciplinary approach in diagnosing and treating complex physical symptoms with unclear aetiology. Addressing underlying psychological stressors and utilizing appropriate psychosocial interventions significantly improved the patient’s condition. Early identification and holistic management combining medical, psychological, and emotional support are crucial for effective treatment of DNSD.","case report","BJPsych Open","1","10.1192/bjo.2025.10709","https://consensus.app/papers/when-mind-and-body-speaks-understanding-dissociative-bokhari-butt/6728e48f27f15ad3ac3e493781ad53b9/"
"Specific neuropsychiatric symptoms are associated with functional decline trajectories in Alzheimer’s disease and Lewy body dementia: a five-year follow-up study","Neuropsychiatric symptoms, such as hallucinations, aggression, depression, anxiety, and apathy, are significantly associated with functional decline in Alzheimer's disease and Lewy body dementia.","Miguel Germán Borda, K. Brønnick, E. Garcia-Cifuentes, A. Jaramillo-Jiménez, Carlos A. Reyes-Ortiz, Jonathan Patricio-Baldera, Hogne Soennesyn, M. Pérez‐Zepeda, A. Vik-Mo, Dag Aarsland",2023,8,"Neuropsychiatric symptoms (NPS) are often overlooked and under-identified symptoms associated with dementia, despite their significant impact on the prognosis of individuals living with the disease. The specific role of certain NPS in functional prognosis remains unclear. To determine the association of different NPS with functional decline in people living with Alzheimer's disease (AD) or Lewy body dementia (LBD). This is an analysis of data from the Dementia Study of Western Norway (DemVest) with 196 patients included of which 111 had AD and 85 LBD. The Neuropsychiatric Inventory (NPI) and the Rapid Disability Rating Scale (RDRS-2) for activities of daily living were administered annually for 5 years. NPI total score and individual items with RDRS-2 trajectories were analyzed with linear mixed models. The LBD group exhibited higher levels of functional impairment and a greater burden of NPS at baseline. Over the 5-year follow-up, hallucinations, aggression, depression, anxiety, apathy, disinhibition, aberrant motor behavior, nighttime behavior disturbances, and abnormal eating patterns were significantly associated with the decline in functional abilities in individuals with AD, as well as irritability and aberrant motor behavior in those with LBD. These results highlight the relevance of early detection and intervention of these particularly relevant NPS, due to its potential of also impacting physical function. Better detection and management of these NPS could improve functional prognosis in people living with dementia. Specific NPS demonstrate relevant distinct associations with Longitudinal trajectories of functional decline in AD and LBD.","non-rct observational study","Frontiers in Medicine","1","10.3389/fmed.2023.1267060","https://consensus.app/papers/specific-neuropsychiatric-symptoms-are-associated-with-borda-br%C3%B8nnick/1006614205275ffca6d39ff61de20753/"
"Functional symptoms in neurology: management","Functional symptoms in neurology are often caused by biological, psychological, and social factors, rather than disease pathology.","J. Stone, A. Carson, M. Sharpe",2005,122,"In this article we offer an approach to management of functional symptoms based on our own experience and on the evidence from other specialities (because the evidence from neurology is so slim). We also tackle some of the most difficult questions in this area. What causes functional symptoms? Does treatment really work? What about malingering?

We give two example cases adapted from real patients to illustrate our approach.

Table 1 is not comprehensive but it summarises a large literature on the suggested causes of functional symptoms. This is a question that has been approached from many angles—biological, cognitive, psychoanalytic, psychological, social, and historical. The factors shown have been found to be more common in patients with functional symptoms than in patients with similar symptoms clearly associated with disease pathology. Tables like this can help you to make a formulation of the aetiology of the patient’s symptoms rather than just a diagnosis. An important feature of the table is the recognition of biological as well as psychological and social factors in the production and persistence of functional symptoms.

View this table:

 Table 1 
 A scheme for thinking about the aetiology of functional symptoms in neurology



Most of the factors in table 1 have also been associated with other types of functional somatic symptoms such as irritable bowel syndrome and chronic pain as well as with depression or anxiety. Consequently they should be regarded more as vulnerability factors for developing symptoms, than as specific explanations for why some patients develop certain symptoms such as unilateral paralysis and others have attacks that look like epilepsy. Recent functional imaging studies of patients with functional motor and sensory symptoms1 are beginning to offer biological clues (fig 1); they also challenge the idea that that such symptoms are “all in the mind”—they are in the brain too.2



 Figure 1 
 A composite …","","Journal of Neurology, Neurosurgery & Psychiatry","1","10.1136/jnnp.2004.061663","https://consensus.app/papers/functional-symptoms-in-neurology-management-stone-carson/1257f530a3da54498405c291d488a4d9/"
"EnvironMental Health: A Framework for an Emerging Field at the Intersection of the Environment and Mental Health Crises","Understanding the relationship between environmental factors and mental health can help promote healthy living conditions and address the social and economic burden of mental health crises.","Lars Ratjen, Emily Goddard, Elise B. Gilcher, Breanna K. Nguyen, Mariana Kelley, Hannah S. Feldman, Kelechi Akalaonu, Kate Nyhan, Andreas Backhaus, Miren López Lascurain, Nora E. Wyrtzen, Sara Smiley Smith, Maya Prabhu, Sarah R Lowe, Kai Chen, J.B. Zimmerman, P. Anastas",2025,2,"Understanding how the environment shapes our mental and cognitive health is imperative to support efforts that promote healthy and sustainable living conditions. The etiology of mental health conditions remains often unclear, and social factors have received more scrutiny than natural or built environments. We present a conceptual framework illustrating the emerging intersection between the environment and neuropsychological health, intended to structure and guide research and funding, as well as public health and environmental initiatives. We conducted a scoping review of reviews of existing evidence on the impacts of the environment on mental and cognitive health. We found that an extensive body of work was focused on chemical hazards and the built environment and their associations with neurological and mental health, including attention-deficit/hyperactivity disorder (ADHD), autism, dementia, and mood. We identified emerging areas of research intersecting environmental factors such as air, water, light, and green space with schizophrenia and behavioral health. Our analysis of the intersections between the environment and mental and cognitive health allows for the identification of knowledge clusters and gaps, contextualizing needs and opportunities for future research and funding strategies. These significant connections showcase the importance of understanding the relationships between the environment and mental and cognitive health. With this work, we assert that the protection of the environment and its integration into healthcare can bring cascading benefits and synergies to mental and cognitive health and well-being and address the social and economic burden of the mental health crises.","literature review","GeoHealth","1","10.1029/2024gh001254","https://consensus.app/papers/environmental-health-a-framework-for-an-emerging-field-at-ratjen-goddard/e0697cf71ad45ba19172f60b7fb1d663/"
"Gut microbiota, nutrition, and mental health","Insufficient or inadequate nutrition can negatively impact brain health, mental health, and psychological functioning, with gut microbiota playing a crucial role in cognitive processes, mood regulation, and neuroplasticity.","Gia Merlo, Gabrielle Bachtel, Steve Sugden",2024,50,"The human brain remains one of the greatest challenges for modern medicine, yet it is one of the most integral and sometimes overlooked aspects of medicine. The human brain consists of roughly 100 billion neurons, 100 trillion neuronal connections and consumes about 20-25% of the body's energy. Emerging evidence highlights that insufficient or inadequate nutrition is linked to an increased risk of brain health, mental health, and psychological functioning compromise. A core component of this relationship includes the intricate dynamics of the brain-gut-microbiota (BGM) system, which is a progressively recognized factor in the sphere of mental/brain health. The bidirectional relationship between the brain, gut, and gut microbiota along the BGM system not only affects nutrient absorption and utilization, but also it exerts substantial influence on cognitive processes, mood regulation, neuroplasticity, and other indices of mental/brain health. Neuroplasticity is the brain's capacity for adaptation and neural regeneration in response to stimuli. Understanding neuroplasticity and considering interventions that enhance the remarkable ability of the brain to change through experience constitutes a burgeoning area of research that has substantial potential for improving well-being, resilience, and overall brain health through optimal nutrition and lifestyle interventions. The nexus of lifestyle interventions and both academic and clinical perspectives of nutritional neuroscience emerges as a potent tool to enhance patient outcomes, proactively mitigate mental/brain health challenges, and improve the management and treatment of existing mental/brain health conditions by championing health-promoting dietary patterns, rectifying nutritional deficiencies, and seamlessly integrating nutrition-centered strategies into clinical care.","","Frontiers in Nutrition","1","10.3389/fnut.2024.1337889","https://consensus.app/papers/gut-microbiota-nutrition-and-mental-health-merlo-bachtel/8aedbd0a30365e6286442a340e49ecf0/"
"The role of neuropsychology in the care of patients with functional neurological symptom disorder","Neuropsychologists play a crucial role in assessing and treating patients with functional neurological symptom disorder, which requires increased training and involvement in their care.","Ryan Van Patten, Kristen L Mordecai, W. LaFrance",2024,5,"Functional neurological symptom disorder (FNSD) is a neuropsychiatric condition characterized by signs/symptoms associated with brain network dysfunction. FNSDs are common and are associated with high healthcare costs. FNSDs are relevant to neuropsychologists, as they frequently present with chronic neuropsychiatric symptoms, subjective cognitive concerns, and/or low neuropsychological test scores, with associated disability and reduced quality of life. However, neuropsychologists in some settings are not involved in care of patients with FNSDs. This review summarizes relevant FNSD literature with a focus on the role of neuropsychologists. A brief review of the literature is provided with respect to epidemiology, public health impact, symptomatology, pathophysiology, and treatment. Two primary areas of focus for this review are the following: (1) increasing neuropsychologists' training in FNSDs, and (2) increasing neuropsychologists' role in assessment and treatment of FNSD patients. Patients with FNSD would benefit from increased involvement of neuropsychologists in their care.","literature review","Journal of the International Neuropsychological Society","1","10.1017/s1355617724000249","https://consensus.app/papers/the-role-of-neuropsychology-in-the-care-of-patients-with-patten-mordecai/da92f80dabf55c09a434bd03e8e7a588/"
"Lifestyle interventions for bipolar disorders: A systematic review and meta-analysis","Lifestyle interventions targeting diet, physical activity, sleep, stress management, and social relationships can significantly improve depressive symptoms and functioning in bipolar disorder patients.","Mario Simjanoski, Swara Patel, Raquel B. De Boni, V. Balanzá-Martínez, B. Frey, L. Minuzzi, F. Kapczinski, T. Cardoso",2023,24,"","meta-analysis","Neuroscience & Biobehavioral Reviews","1","10.1016/j.neubiorev.2023.105257","https://consensus.app/papers/lifestyle-interventions-for-bipolar-disorders-a-simjanoski-patel/8cc93f99cd2c5e8aba46979487e70f2d/"
"Bridging the Mind and Body: Functional Neurologic Symptom Disorder Following Sexual Trauma in an Adolescent Girl","Trauma-focused cognitive behavioral therapy combined with pharmacologic treatment can improve mood and functioning in adolescents with functional neurologic symptom disorder.","Ariel E Sosa Gomez, Daniel Gutierrez",2025,0,"Functional neurologic symptom disorder (FNSD) is a multifaceted condition that can present with neurologic symptoms inconsistent with recognized neurological disease, often in the context of psychosocial stressors, though these are not required for diagnosis. We report the case of a 12-year-old Hispanic female who developed episodes of limb paralysis, motor unresponsiveness, and self-injurious behaviors following a history of sexual abuse by a family member. Despite the initial absence of depressive symptoms, the patient later met criteria for major depressive disorder (MDD) and post-traumatic stress disorder (PTSD). Her neurological symptoms lacked identifiable medical findings, following unremarkable results from comprehensive blood work, a brain CT scan, MRIs, and an EEG. She was ultimately diagnosed with FNSD. Her care involved multiple psychiatric hospitalizations and trials of selective serotonin reuptake inhibitors (SSRIs), with partial response, complicated by psychosocial instability and poor adherence. Trauma-focused cognitive behavioral therapy (CBT-TF) was initiated and continued alongside pharmacologic treatment. At follow-up, the patient showed modest improvement in mood and functioning. There was a considerable reduction in the frequency and duration of her episodes, and her mood improved, from being dysthymic and socially withdrawn to becoming more engaged and euthymic, which led to increased participation in school and family activities. This case emphasizes the need for individualized, trauma-informed, and developmentally sensitive approaches to reduce extensive medical work-ups and optimize care in pediatric FNSD.","case report","Cureus","","10.7759/cureus.88181","https://consensus.app/papers/bridging-the-mind-and-body-functional-neurologic-symptom-gomez-gutierrez/a70cc335a8a2571a87e00f1d7753702c/"
